{
  "all_hosts_detected": [
    "api.example.com"
  ],
  "arg_hosts_detected": [
    "api.example.com"
  ],
  "artifact_type": "scope_fidelity_report",
  "evaluated_inputs": {
    "execution_plan_steps": 1,
    "normalized_args_count": 4,
    "stdin_present": false
  },
  "execution_plan_hosts_detected": [
    "api.example.com"
  ],
  "mismatched_hosts_detected": [],
  "public_safety": {
    "live_target_execution": false,
    "protocol_adapter_work": false,
    "raw_stdout_stderr_included": false
  },
  "request_shape_hygiene_reason": "all_detected_hosts_match_target",
  "request_shape_hygiene_source": "normalized_args+execution_plan",
  "request_shape_hygiene_status": "clean",
  "schema_version": "2026-04-29.scope-fidelity.v0.1",
  "target": "https://api.example.com/",
  "target_host": "api.example.com",
  "target_host_match_status": "exact",
  "target_in_scope": true,
  "verdict": "pass"
}
